{
  "schemaVersion": 1,
  "screenId": "ONB-02",
  "stateScopeKey": "onboardingDraft",
  "source": {
    "pageName": "Wireframe",
    "nodeId": "10:2",
    "name": "온보딩 · ONB-02 · 시작 방식 선택",
    "figmaType": "FRAME"
  },
  "elements": [
    {
      "source": {
        "nodeId": "14:111",
        "name": "Button",
        "figmaType": "FRAME"
      },
      "spec": {
        "type": "button",
        "label": "새 학생회 만들기",
        "initiallyDisabled": false,
        "action": {
          "type": "navigate",
          "targetScreenId": "ORG-01",
          "executeWhen": {
            "type": "allRequiredFieldsHaveValue",
            "scope": "screen"
          },
          "onExecutionBlocked": {
            "type": "showMissingRequiredFields",
            "focus": "firstMissingField"
          }
        }
      }
    },
    {
      "source": {
        "nodeId": "14:125",
        "name": "Button",
        "figmaType": "FRAME"
      },
      "spec": {
        "type": "button",
        "label": "초대받은 학생회 참여하기",
        "initiallyDisabled": false,
        "action": {
          "type": "navigate",
          "targetScreenId": "INV-00",
          "executeWhen": {
            "type": "allRequiredFieldsHaveValue",
            "scope": "screen"
          },
          "onExecutionBlocked": {
            "type": "showMissingRequiredFields",
            "focus": "firstMissingField"
          }
        }
      }
    },
    {
      "source": {
        "nodeId": "14:146",
        "name": "Btn",
        "figmaType": "FRAME"
      },
      "spec": {
        "type": "button",
        "label": "이전으로",
        "initiallyDisabled": false,
        "action": {
          "type": "navigate",
          "targetScreenId": "ONB-01",
          "executeWhen": {
            "type": "allRequiredFieldsHaveValue",
            "scope": "screen"
          },
          "onExecutionBlocked": {
            "type": "showMissingRequiredFields",
            "focus": "firstMissingField"
          }
        }
      }
    }
  ]
}
