{
  "schemaVersion": 1,
  "screenId": "ONB-01",
  "stateScopeKey": "onboardingDraft",
  "source": {
    "pageName": "Wireframe",
    "nodeId": "3:2",
    "name": "온보딩 · ONB-01 · 본인 소속 입력",
    "figmaType": "FRAME"
  },
  "elements": [
    {
      "source": {
        "nodeId": "7:29",
        "name": "Text Input",
        "figmaType": "FRAME"
      },
      "spec": {
        "type": "input",
        "fieldKey": "name",
        "label": "이름",
        "placeholder": "김바다",
        "initialValue": null,
        "inputType": "text",
        "valueType": "string",
        "required": true,
        "validation": []
      }
    },
    {
      "source": {
        "nodeId": "7:34",
        "name": "Text Input",
        "figmaType": "FRAME"
      },
      "spec": {
        "type": "input",
        "fieldKey": "studentNumber",
        "label": "학번",
        "placeholder": "예: 2022123456",
        "initialValue": null,
        "inputType": "text",
        "valueType": "string",
        "required": true,
        "validation": []
      }
    },
    {
      "source": {
        "nodeId": "7:46",
        "name": "Text Input",
        "figmaType": "FRAME"
      },
      "spec": {
        "type": "select",
        "fieldKey": "school",
        "label": "학교",
        "placeholder": "학교명을 검색하세요",
        "initialValue": null,
        "valueType": "string",
        "required": true,
        "initiallyDisabled": false,
        "searchable": true,
        "optionsSource": {
          "key": "education.schools"
        }
      }
    },
    {
      "source": {
        "nodeId": "7:57",
        "name": "Text Input",
        "figmaType": "FRAME"
      },
      "spec": {
        "type": "select",
        "fieldKey": "college",
        "label": "단과대학",
        "placeholder": "학교를 먼저 선택하세요",
        "initialValue": null,
        "valueType": "string",
        "required": true,
        "initiallyDisabled": true,
        "searchable": true,
        "optionsSource": {
          "key": "education.colleges",
          "params": {
            "schoolId": "school"
          }
        },
        "enabledWhen": [
          {
            "fieldKey": "school",
            "operator": "hasValue"
          }
        ],
        "resetOnChangeOf": [
          "school"
        ]
      }
    },
    {
      "source": {
        "nodeId": "7:68",
        "name": "Text Input",
        "figmaType": "FRAME"
      },
      "spec": {
        "type": "select",
        "fieldKey": "department",
        "label": "학부·학과",
        "placeholder": "단과대학을 먼저 선택하세요",
        "initialValue": null,
        "valueType": "string",
        "required": true,
        "initiallyDisabled": true,
        "searchable": true,
        "optionsSource": {
          "key": "education.departments",
          "params": {
            "schoolId": "school",
            "collegeId": "college"
          }
        },
        "enabledWhen": [
          {
            "fieldKey": "college",
            "operator": "hasValue"
          }
        ],
        "resetOnChangeOf": [
          "school",
          "college"
        ]
      }
    },
    {
      "source": {
        "nodeId": "7:75",
        "name": "Dropdown",
        "figmaType": "FRAME"
      },
      "spec": {
        "type": "select",
        "fieldKey": "currentGrade",
        "label": "현재 학년",
        "placeholder": null,
        "initialValue": null,
        "valueType": "string",
        "required": true,
        "initiallyDisabled": false,
        "searchable": false,
        "optionsSource": {
          "key": "education.currentGrades"
        }
      }
    },
    {
      "source": {
        "nodeId": "7:77",
        "name": "Btn",
        "figmaType": "FRAME"
      },
      "spec": {
        "type": "button",
        "label": "다음: 시작 방식 선택",
        "initiallyDisabled": false,
        "action": {
          "type": "navigate",
          "targetScreenId": "ONB-02",
          "executeWhen": {
            "type": "allRequiredFieldsHaveValue",
            "scope": "screen"
          },
          "onExecutionBlocked": {
            "type": "showMissingRequiredFields",
            "focus": "firstMissingField"
          }
        }
      }
    }
  ]
}
